{
  "metadata": {
    "document_id": "static_context_packet.json",
    "title": "Static Context Packet",
    "purpose": "Compiled static authority and operational context from StaticContextPacketManifest.",
    "source_format": "json",
    "document_authority": "compiled_runtime_artifact"
  },
  "sources": {
    "governance_primitives": {
      "$schema": "./GovernancePrimitives.schema.json",
      "metadata": {
        "document_id": "governance_primitives.json",
        "title": "Governance Primitives",
        "context": "Global governance for the CLI harness. These primitives govern agent operation, execution boundaries, runtime artifact semantics, and authority separation in every target repository the harness is placed inside and invoked against.",
        "purpose": "Define and delineate global harness-level invariants from harness target repository boundaries that every project workflow must respect.",
        "source_format": "json",
        "document_authority": "global_harness"
      },
      "document_authority_classes": {
        "binding_authority": [
          "global_harness",
          "harness_target",
          "runtime_policy",
          "operational_state"
        ],
        "derived_runtime_artifacts": [
          "compiled_runtime_artifact",
          "output_policy_artifact",
          "raw_provider_artifact"
        ]
      },
      "agent_contracts": [
        "project_manager",
        "planning_manager",
        "review_manager",
        "red_team_manager",
        "implementation_manager",
        "archive_manager",
        "worker_adapter"
      ],
      "approval_sensitive_surfaces": [
        "global_harness",
        "agent_contracts",
        "output_policies",
        "runtime_orchestration",
        "tool_and_worker_surface",
        "provider_or_api_behavior",
        "compatibility_commitments"
      ]
    },
    "project_spec": {
      "$schema": "ProjectSpec.schema.json",
      "metadata": {
        "document_id": "project_spec.json",
        "title": "Project Spec",
        "purpose": "Authoritative invariant space for the CLI harness project.",
        "source_format": "json",
        "document_authority": "harness_target"
      },
      "project_thesis": {
        "project_is": [
          "A CLI harness for governed agent-assisted software work.",
          "A system that lets users implement ideas in code through explicit tasks, bounded agent roles, inspectable artifacts, approval gates, and runnable validation probes rather than requiring the user to infer or directly verify code internals.",
          "A repo-local coordination system that turns tasks, role contracts, context packets, runtime policies, reports, run artifacts, and probes into explicit inspectable surfaces.",
          "A harness for making agent participation bounded, reproducible, auditable, and approval-gated rather than chat-shaped or ambient."
        ],
        "project_is_not": {
          "excluded_product_forms": [
            "A chatbot UI.",
            "An IDE extension.",
            "A generic RAG assistant.",
            "A generic autonomous coding agent.",
            "A hidden-memory system."
          ],
          "excluded_agent_patterns": [
            "Free-form multi-agent group chat.",
            "Agents deciding their own tool access.",
            "Agents treating conversational momentum as implementation authority.",
            "Workers mutating repository files without an explicit approval boundary."
          ],
          "design_guardrail": [
            "The harness does not try to make coding agents magical; it makes their claims, inputs, permissions, and evidence inspectable."
          ]
        },
        "project_exists_to": {
          "delineate_boundaries": [
            "Prompt versus policy.",
            "Context versus authority.",
            "Template/example artifact versus live runtime artifact.",
            "Schema contract versus model-generated content.",
            "Planning versus implementation.",
            "Governance role versus file-mutating worker.",
            "Model claim versus deterministic probe evidence.",
            "Active implementation state versus archived evidence."
          ],
          "instantiate_governance": [
            "Compile bounded context packets before model calls.",
            "Load explicit role contracts rather than relying on chat memory.",
            "Validate model outputs against structured report contracts.",
            "Save run artifacts so later review can inspect what actually happened.",
            "Require deterministic probes before treating a slice as runtime-evidenced.",
            "Gate file mutation and worker execution behind explicit approval."
          ]
        },
        "core_runtime_shape": [
          "A CLI command receives a task and selects an explicit workflow route.",
          "The context compiler gathers repo-local authoritative inputs into a project context packet.",
          "The role loader loads the selected role contract and enforces fixed role invariants.",
          "The agent caller sends a bounded model request using the configured provider route.",
          "The returned report is parsed and validated against the runtime output schema.",
          "The run artifact writer saves task, context packet, report, validation summary, and probe evidence under a timestamped run directory.",
          "The orchestrator prints a short truthful terminal summary and stops at the workflow boundary.",
          "Planner, reviewer, adversary, implementer, and archivist routes may be added later only as explicit governed routes.",
          "Worker adapters may mutate repository files only after an approval boundary and must remain separate from governance roles."
        ],
        "primary_operator": "A local developer/operator using model assistance to build software while keeping context, authority, role behavior, tool permissions, and evidence inspectable with no formal coding experience.",
        "highest_value_workflow": {
          "command": "null",
          "args": [
            "null"
          ],
          "expectations": [
            "null"
          ],
          "stop_condition": "null"
        }
      },
      "non_goals": {
        "do_not_build": [
          "A web UI.",
          "A desktop UI.",
          "A VS Code extension.",
          "A vector database or RAG system.",
          "A generic task manager.",
          "Automatic repo mutation from a planning command.",
          "Recursive agent self-improvement.",
          "Provider abstraction beyond the first bounded provider route needed by the current implementation."
        ],
        "do_not_fake": [
          "Runtime capability from scaffolding alone.",
          "Passing status without saved artifacts.",
          "Implementation evidence from a plausible model report.",
          "Known failures, open decisions, or active implementation files as placeholder bureaucracy."
        ],
        "do_not_smooth_over": [
          "Missing files.",
          "Schema/document disagreements.",
          "Contradictions between report status and proof frontier state.",
          "Provider dependency mismatches.",
          "Unclear runtime versus authoring artifact boundaries."
        ],
        "do_not_preserve_without_approval": [
          "Legacy scaffold layouts.",
          "Donor-code assumptions.",
          "Compatibility shims.",
          "Tool permission surfaces that no active role needs."
        ]
      },
      "architectural_shape": {
        "required_runtime_surfaces": [
          "CLI entrypoint.",
          "Deterministic orchestrator.",
          "Task brief writer.",
          "Project context compiler.",
          "Static context packet manifest/reference policy.",
          "Role contract loader.",
          "Provider/model caller boundary.",
          "Structured output parser.",
          "Schema/Pydantic report validator.",
          "Run artifact writer.",
          "Deterministic acceptance probes.",
          "Implementation project state surface.",
          "Worker adapter boundary.",
          "Archive surface."
        ],
        "required_evidence_boundaries": [
          "Role contract versus runtime output schema.",
          "Runtime output schema versus returned report.",
          "Project spec versus current user task.",
          "Invariant authority versus task authority.",
          "Template/example artifact versus live runtime artifact.",
          "Scaffold evidence versus runtime evidence.",
          "Plan versus apply.",
          "Governance agent versus file-mutating worker.",
          "Model-generated claim versus deterministic probe result.",
          "Archived history versus active implementation state."
        ],
        "required_inspectable_surfaces": {
          "default_location": "../runs/<timestamp>/",
          "min_required_artifacts": [
            "task.json",
            "static_context_packet.json",
            "project_manager_report.json"
          ],
          "optional_debug_artifacts": [
            "rendered_request.json",
            "validation_summary.json",
            "probe_summary.json"
          ],
          "authoritative_context_artifact": "static_context_packet.json",
          "authoritative_pm_runtime_output_artifacts": "project_manager_report.json"
        },
        "dependencies": {
          "required": [
            "Python runtime.",
            "Pydantic validation layer.",
            "OpenAI Python SDK v2-compatible route for the first provider path.",
            "OPENAI_API_KEY or equivalent configured outside committed files.",
            "Local filesystem access for repo-local inputs and ../runs/** artifacts.",
            "Local git availability where possible."
          ],
          "excluded": [
            "No external database for the first implementation.",